{
  "schema_version": 1,
  "scenario_id": "b2-g1-contention",
  "deal_type": "vm",
  "provisioning": "real-kvm-ansible",
  "gpu_assignment": "whole-device-passthrough",
  "listing": {
    "count": 1,
    "gpus_per_vm": 1,
    "seller_distribution": [1]
  },
  "wave": {
    "buyers": 2,
    "sellers": 1,
    "requests": 2,
    "expected_successes": 1,
    "expected_scarcity": 1,
    "retry_count": 0
  }
}
